{
  "backend_authority": "existing_researchforge_backend",
  "default_bind": "127.0.0.1:8001",
  "default_transport": "stdio",
  "product_version": "1.8.5",
  "remote_transport": "streamable-http",
  "schema_version": "1.8.0",
  "server_name": "researchforge",
  "tools": [
    {
      "destructive": false,
      "idempotent": true,
      "name": "resolve_company",
      "open_world": true,
      "read_only": true
    },
    {
      "destructive": false,
      "idempotent": true,
      "name": "discover_filing",
      "open_world": true,
      "read_only": true
    },
    {
      "destructive": false,
      "idempotent": false,
      "name": "run_company_research",
      "open_world": true,
      "read_only": false
    },
    {
      "destructive": false,
      "idempotent": true,
      "name": "get_research_result",
      "open_world": false,
      "read_only": true
    },
    {
      "destructive": false,
      "idempotent": true,
      "name": "get_research_trace",
      "open_world": false,
      "read_only": true
    },
    {
      "destructive": false,
      "idempotent": true,
      "name": "get_financial_facts",
      "open_world": false,
      "read_only": true
    },
    {
      "destructive": false,
      "idempotent": true,
      "name": "search_filing_evidence",
      "open_world": false,
      "read_only": true
    }
  ]
}
